content,label,has_url,has_phone_number,sender_type
"[TB] Ra mắt gói mới, ưu đãi 50% Có 5GB/ngày, miễn phí gọi nội mạng (20 phút/cuộc), SMS nội mạng, TV360: 1. Soạn 1N gửi 191: 10K/ngày, có thêm 5 phút thoại ngoại mạng 2. Soạn 3N gửi 191: 30K/3 ngày, có thêm 15 phút thoại ngoại mạng Từ lần thứ 2 đăng ký/gói (sau lần đầu 30 phút), giảm 50% giá: Gói 1N còn 5K/ngày, gói 3N còn 15K/3 ngày DV gia hạn khi hết chu kỳ với giá gốc. KM dành riêng cho Quý khách, áp dụng tối đa 3 lần/gói từ 04/08 đến hết 31/08. LH 198 (0đ).",0.0,0,0,brandname
"Ma xac nhan la 8499, vui long vao trang thisinh.thitotnghiepthpt.edu.vn nhap ma xac nhan trong 30 phut de dang ky (phi gui: 1.000d/tin).",0.0,1,0,unknown
"[TB] KHUYẾN MẠI HÔM NAY! NHẬN NGAY 20% giá trị tất cả thẻ nạp trong ngày 01/08, tiền KM sử dụng nội mạng trong 15 ngày. Giảm thêm đến 10% khi nạp thẻ tại https://vt.vtmoney.vn/kmdt253 . Nạp thẻ ngay và tham gia ưu đãi: Soạn V50C gửi 191: 50K/30 ngày có 3GB, miễn phí gọi nội mạng. Chi tiết gói cước tại https://myvt.page.link/V50C CT dành riêng cho Quý khách. LH 198 (0đ).",0.0,1,0,brandname
"THPT N C Tru: Truoc tinh hinh dich benh COVID-19 dang co xu huong gia tang tro lai,cac bac phu huynh hay dua tre tu 5 den duoi 18 tuoi di tiem vac xin phong COVID-19 (mui 1 va mui 2),neu chua tiem. Neu da tiem roi,hay di tiem mui nhac lai. Tiem chung day du mui co ban va mui nhac lai se lam tang hieu qua bao ve tre truoc dich benh COVID-19 ngay ca cac bien the phu BA.4,BA.5. Tran trong",0.0,0,0,brandname
"Quy khach vui long chuan bi san pham doi tra trong DH 660759049, TED se den thu hoi CRPICK2207100572 truoc 14:00 ngay 21/07. Tran trong.",0.0,0,0,brandname
"VIET UC - Duy nhat 30 suat lien thong lay bang CU NHAN Dai Hoc Kinh Te TPHCM (UEH), dieu kien: TN THPT, khai giang 10/8/2022. LH 0836286786.",0.0,0,1,brandname
805404 la ma xac minh dang ky tai khoan BAEMIN cua ban. Ma co hieu luc trong 15 phut. Khong chia se voi nguoi khac ban nhe.,0.0,0,0,brandname
"[TB] KHUYẾN MẠI HÔM NAY! NHẬN NGAY 20% giá trị tất cả thẻ nạp trong ngày 20/07, tiền KM sử dụng nội mạng trong 15 ngày. Giảm thêm đến 10% khi nạp thẻ tại https://vt.vtmoney.vn/kmdt253 . Nạp thẻ ngay và tham gia ưu đãi: Soạn V50C gửi 191: 50K/30 ngày có 3GB, miễn phí gọi nội mạng. Chi tiết gói cước tại https://myvt.page.link/V50C CT dành riêng cho Quý khách. LH 198 (0đ).",0.0,1,0,brandname
"SHOPEE: DE CAP NHAT SO DIEN THOAI, nhap ma xac minh 391146. Ma co hieu luc trong 15 phut. KHONG chia se ma nay voi nguoi khac, ke ca nhan vien Shopee. PReCTjZ0mJK",0.0,0,0,brandname
"EVNHCMC TB TIEN DIEN T7/22 KH PE13000143179 LA 99,976 VND VUI LONG T.TOAN TRUOC 22/07/2022 LH 1900545454",0.0,0,1,brandname
"EVNHCMC TB TIEN DIEN T7/22 KH PE13000146339 LA 393,060 VND VUI LONG T.TOAN TRUOC 22/07/2022 LH 1900545454",0.0,0,1,brandname
"EVNHCMC TB-Ky1T07 GHI 00:25 16/07/22 CSM1942, CSC1746 KH PE13000146339 LA196kWh TIEN 393060VND THU TIEN TU 18/07/22 LH 1900545454",0.0,0,1,brandname
"EVNHCMC TB-Ky1T07 GHI 00:45 16/07/22 CSM417, CSC362 KH PE13000143179 LA55kWh TIEN 99976VND THU TIEN TU 18/07/22 LH 1900545454",0.0,0,1,brandname
"[TB] Ủy ban nhân dân TP.HCM triển khai chương trình Khuyến mại tập trung - Mùa mua sắm ""Shopping Season"" trên địa bàn TP.HCM năm 2022, thời gian từ ngày 15/6/2022 - 15/7/2022, với chủ đề: Tưng bừng mua sắm Hè 2022, hạn mức khuyến mại tối đa lên đến 100%. ",0.0,0,0,brandname
"DH Gia Dinh TP.HCM xet tuyen hoc ba THPT. Dao tao 3 nam, hoc phi 7,5-12,5 tr/HK.Xet tuyen tu 18-25/7. Link: https://bit.ly/3RIwaiK. LH:0962121018-0862121018",0.0,1,1,brandname
"[TB] Deal siêu hời, chốt lời siêu tốc Soạn V120Z gửi 191: Chỉ còn 65K/30 ngày (giá gốc 90K) có 120GB (4GB/ngày), miễn phí gọi điện. Gói cước gia hạn sau 30 ngày với giá gốc. Chi tiết gói cước truy cập https://viettel.vn/s/v120Z .  CT áp dụng với lần đăng ký đầu tiên đến hết 16/07/2022 cho TB của cho Quý khách. LH 198 (0đ).",0.0,1,0,brandname
"Quy KH vui long nhap ma 601343 de xac nhan giao dich trong vong 3 phut. Truong hop khong thuc hien, vui long bo qua thong bao nay. LH 1900545454.",0.0,0,1,brandname
"Ke tu ngay 01/08/2022, EVNHCMC ngung nhan tin SMS, Quy KH vui long kiem tra ung dung CSKH, Zalo, Email de nhan thong bao tien dien va cac thong tin ve dien khac. De cai dat ung dung EVNHCMC CSKH, Quy KH truy cap cskh.evnhcmc.vn/tuvan/ungdungcskh hoac lien he 1900545454 de duoc ho tro. Tran trong.",0.0,1,1,brandname
"Quy khach duoc cong them 2 diem Viettel++ boi giao dich Tieu dung vien thong thang 06/2022. Thoi han su dung diem den 31/07/2023. Hay truy cap https://myvt.page.link/vtplus tren My Viettel hoac *098# de doi diem sang Data, SMS, Phut goi cung nhieu uu dai gia tri khac. Chi tiet LH 198. Tran trong.",0.0,1,0,brandname
"If you believe in yourself, you do not have to fear any challenge. Hoa Sen University wishes you the best of luck and success for your high school graduation exams in 2022.  Don't let anything hold you back! Go for it! Contact: 0908275276",0.0,0,1,brandname
"[TB] Deal siêu hời, chốt lời siêu tốc Soạn V120Z gửi 191: Chỉ còn 65K/30 ngày (giá gốc 90K) có 120GB (4GB/ngày), miễn phí gọi điện. Gói cước gia hạn sau 30 ngày với giá gốc. Chi tiết gói cước truy cập https://viettel.vn/s/v120Z .  CT áp dụng với lần đăng ký đầu tiên đến hết 06/07/2022 cho TB của cho Quý khách. LH 198 (0đ).",0.0,1,0,brandname
Truong DH GTVT - Phan hieu tai Tp. HCM (GSA) chuc mung Thi sinh Nguyen Hoang Duy du dieu kien trung tuyen (tru dieu kien TN THPT) vao nganh Logistics va Quan ly chuoi cung ung theo hoc ba THPT. Chi tiet xem tai Website: tuyensinh.utc2.edu.vn,0.0,1,0,brandname
"[TB] ĐÓN CHÀO THÁNG MỚI! Nạp thẻ trong hôm nay (1/7) để nhận KM 20% và đăng ký gói ưu đãi: 120K/30 ngày có 2GB/ngày, miễn phí gọi điện (soạn V120C gửi 191, chi tiết gói cước tại https://myvt.page.link/V120C ) Lưu ý: Thẻ nạp vào tài khoản viễn thông, tiền KM sử dụng nội mạng đến hết ngày 16/07/2022. Giảm thêm đến 10% khi nạp thẻ tại https://vt.vtmoney.vn/kmdt253 CT dành riêng cho Quý khách. LH 198 (0đ).",0.0,1,0,brandname
"Chuc mung thi sinh NGUYEN HOANG DUY da du dieu kien trung tuyen (tru dieu kien TNTHPT) vao Truong DH CNTT - DHQG-HCM (UTXT-DHQG) nganh CONG NGHE THONG TIN. Chi tiet xem tai: https://tuyensinh.uit.edu.vn/giaybao-kqxt, hotline 0971203246",0.0,1,1,brandname
"Chuc mung thi sinh NGUYEN HOANG DUY da du dieu kien trung tuyen (tru dieu kien TNTHPT) vao Truong DH CNTT - DHQG-HCM (DGNL)  nganh CONG NGHE THONG TIN. Chi tiet xem tai: https://tuyensinh.uit.edu.vn/giaybao-kqxt, hotline 0971203246",0.0,1,1,brandname
"VTC Academy tang khoa hoc online Onlinica. Xem ngay tuyet chieu lam bai thi THPT 2022 nhanh, diem cao tai https://onlinica.com/2022 . Tao tai khoan free voi SDT",0.0,1,0,brandname
"[TB] Để bảo đảm an toàn phòng cháy trong sử dụng điện, Bộ Công an khuyến cáo: Không sử dụng nhiều thiết bị điện có công suất lớn vào cùng một ổ cắm; không để hàng hóa, vật dụng dễ cháy gần các thiết bị điện sinh nhiệt; thường xuyên kiểm tra, sửa chữa, thay thế thiết bị điện và mạng điện hư hỏng; khi sử dụng thiết bị sinh nhiệt như bàn là, bếp điện… phải có người trông coi; ngắt nguồn và các thiết bị điện khi không sử dụng.",0.0,0,0,brandname
Do su co tam gian doan cap dien Khach hang PE13000143179 tu 17:51 - 19:51 ngay 22/06/2022. Kinh xin loi quy Khach hang va mong duoc thong cam. LH 1900545454,0.0,0,1,brandname
Do su co tam gian doan cap dien Khach hang PE13000146339 tu 17:51 - 19:51 ngay 22/06/2022. Kinh xin loi quy Khach hang va mong duoc thong cam. LH 1900545454,0.0,0,1,brandname
"Cam on Quy KH PE13000146339 da thanh toan so tien dien thang 6/2022, so tien 440,104d. LH 1900545454",0.0,0,1,brandname
Do su co tam gian doan cap dien Khach hang PE13000143179 tu 05:59 - 08:59 ngay 22/06/2022. Kinh xin loi quy Khach hang va mong duoc thong cam. LH 1900545454,0.0,0,1,brandname
Do su co tam gian doan cap dien Khach hang PE13000146339 tu 05:59 - 08:59 ngay 22/06/2022. Kinh xin loi quy Khach hang va mong duoc thong cam. LH 1900545454,0.0,0,1,brandname
"EVNHCMC TB TIEN DIEN T6/22 KH PE13000146339 LA 440,104 VND VUI LONG T.TOAN TRUOC 22/06/2022 LH 1900545454",0.0,0,1,brandname
"EVNHCMC TB TIEN DIEN T6/22 KH PE13000143179 LA 99,976 VND VUI LONG T.TOAN TRUOC 22/06/2022 LH 1900545454",0.0,0,1,brandname
Do su co tam gian doan cap dien Khach hang PE13000143179 tu 17:02 - 21:15 ngay 17/06/2022. Kinh xin loi quy Khach hang va mong duoc thong cam. LH 1900545454,0.0,0,1,brandname
Do su co tam gian doan cap dien Khach hang PE13000146339 tu 17:02 - 21:15 ngay 17/06/2022. Kinh xin loi quy Khach hang va mong duoc thong cam. LH 1900545454,0.0,0,1,brandname
"EVNHCMC TB-Ky1T06 GHI 00:25 16/06/22 CSM1746, CSC1532 KH PE13000146339 LA214kWh TIEN 440104VND THU TIEN TU 18/06/22 LH 1900545454",0.0,0,1,brandname
"EVNHCMC TB-Ky1T06 GHI 00:42 16/06/22 CSM362, CSC307 KH PE13000143179 LA55kWh TIEN 99976VND THU TIEN TU 18/06/22 LH 1900545454",0.0,0,1,brandname
"[TB] Bộ Thông tin và Truyền thông: Hãy cài đặt sử dụng ứng dụng i-Speed để kiểm tra tốc độ truy cập Internet của bạn. Việc hưởng ứng sử dụng thường xuyên của bạn sẽ góp phần thúc đẩy phát triển, nâng cao chất lượng dịch vụ Internet Việt Nam. Cài đặt ứng dụng i-Speed tại https://speedtest.vn/tai-ve (miễn cước data khi sử dụng).",0.0,1,0,brandname
"[TB] Deal siêu hời, chốt lời siêu tốc Soạn V120Z gửi 191: Chỉ còn 65K/30 ngày (giá gốc 90K) có 120GB (4GB/ngày), miễn phí gọi điện. Gói cước gia hạn sau 30 ngày với giá gốc. Chi tiết gói cước truy cập https://viettel.vn/s/v120Z .  CT áp dụng với lần đăng ký đầu tiên đến hết 16/06/2022 cho TB của cho Quý khách. LH 198 (0đ).",0.0,1,0,brandname
THPT N C Tru 12A7 N H Duy :  (Thong bao) Nghi hoc khong phep(14/6),0.0,0,0,brandname
Don hang 1689112485513 da giao thanh cong. Quy khach vui long danh gia thai do nhan vien giao hang qua link: http://yk.vtp.vn/s/_ZXa0KJDlKd5k9P9r0Te8Q,0.0,1,0,brandname
THPT N C Tru 12A7 N H Duy :  (Thong bao) Nghi hoc khong phep(13/6),0.0,0,0,brandname
(QC-VTL2) Ngân hàng VIB kính tặng quý khách thẻ tín dụng mua trước trả sau Online Plus hạn mức lên tới 100 triệu đồng. MIỄN PHÍ thường niên năm đầu. Từ chối soạn TC gửi 1313.  Đăng ký trực tuyến - duyệt thẻ tự động:  https://onlinecard.vib.com.vn/offer/op_sms,0.0,1,0,brandname
Don hang 1689112485513 cua Quy khach se duoc giao truoc 24 gio. Vui long lien he nhan vien giao hang: Hoang Le Phuoc Nguyen - 84987515130 hoac tra cuu qua app vtp.vn/ap va kenh Zalo vtp.vn/OA,0.0,1,1,brandname
"Quy khach duoc cong them 2 diem Viettel++ boi giao dich Tieu dung vien thong thang 05/2022. Thoi han su dung diem den 30/06/2023. Hay truy cap https://myvt.page.link/vtplus tren My Viettel hoac *098# de doi diem sang Data, SMS, Phut goi cung nhieu uu dai gia tri khac. Chi tiet LH 198. Tran trong.",0.0,1,0,brandname
"[TB] Thông tin thuê bao của Quý khách có thể chưa chính xác. Quý khách vui lòng soạn TTTB gửi 1414 để kiểm tra. Để không bị chặn 1 chiều, Quý khách đăng ký đúng thông tin thuê bao tại https://viettel.vn/s/chtt hoặc đến điểm giao dịch Viettel (mang CMND/CCCD/Hộ chiếu) để được hỗ trợ trước 07/06/2022. Nếu Quý khách đã thực hiện, vui lòng bỏ qua tin nhắn này. LH 198 (0đ). Trân trọng!",0.0,1,0,brandname
"Cam on Quy KH PE13000146339 da thanh toan so tien dien thang 5/2022, so tien 418,193d. LH 1900545454",0.0,0,1,brandname
"[QC] ME VANG NHA, BA LA SIEU NHAN - Chuong trinh truyen hinh thuc te ve gia dinh dang chu y nhat mua he nay. Moi Quy khan gia don xem vao 20h30 thu 5 hang tuan tren kenh HTV7. Chi tiet LH 18008119 (0d). Tu choi QC, soan TC4 gui 199.",0.0,0,1,brandname
"EVNHCMC TB TIEN DIEN T5/22 KH PE13000143179 LA 94,357 VND VUI LONG T.TOAN TRUOC 22/05/2022 LH 1900545454",0.0,0,1,brandname
"EVNHCMC TB TIEN DIEN T5/22 KH PE13000146339 LA 418,193 VND VUI LONG T.TOAN TRUOC 22/05/2022 LH 1900545454",0.0,0,1,brandname
"EVNHCMC TB-Ky1T05 GHI 00:24 16/05/22 CSM1532, CSC1326 KH PE13000146339 LA206kWh TIEN 418193VND THU TIEN TU 18/05/22 LH 1900545454",0.0,0,1,brandname
"EVNHCMC TB-Ky1T05 GHI 00:41 16/05/22 CSM307, CSC255 KH PE13000143179 LA52kWh TIEN 94357VND THU TIEN TU 18/05/22 LH 1900545454",0.0,0,1,brandname
"[QC] Internet Viettel gói NET2PLUS: Chỉ từ 220.000đ/tháng, tốc độ 80 Mbps, vùng phủ Wifi rộng, ổn định. Miễn phí lắp đặt và ưu đãi tặng thêm 2-4 tháng cước TB khi đóng trước cước 6-12 tháng tại https://viettel.vn/s/ftth2. CT áp dụng tại khu vực nội thành Hà Nội và HCM. Chi tiết LH 18008168 (0đ). Từ chối QC, soạn TC3 gửi 199.",0.0,1,1,brandname
"THPT N C Tru N H Duy Diem danh gia CK: TD D,QP 10,Ly 9.5,NN 8.4,Dia 9.5,Van 7.8,Hoa 9.8,Toan 9.2,GDCD 9.3,Su 8.3,CNghe 9.2,Tin 7.8,Sinh 8.3",0.0,0,0,brandname
"[TB] GÓI RẺ 50K - DATA KHÔNG GIỚI HẠN! Chỉ 50.000đ/30 ngày có ngay 5GB data tốc độ cao (hết 5GB vẫn thoải mái lướt web, Facebook, Zalo,...). DV gia hạn sau 30 ngày. Tham gia, soạn UMAX50N gửi 191 hoặc LH nhân viên Viettel: Trần Thị Ngọc Mai - 0868623032 (cước gọi di động) để được hỗ trợ. GIẢM GIÁ 20% khi mua gói data trên Viettel Money tại https://km.vtmoney.vn/314y/91fb895f . CT dành riêng cho Quý khách. Chi tiết LH 198 (0đ).",0.0,1,1,brandname
Don hang KOV160433272 da giao thanh cong. Quy khach vui long danh gia thai do nhan vien giao hang qua link: http://yk.vtp.vn/s/76cOFMyYm3w3b6veGj2adQ,0.0,1,0,brandname
"[TB] Quy khach co 5053 diem tieu dung Viettel++ tinh den het ngay 02/05/2022. Bam goi *098# hoac truy cap ung dung My Viettel tai https://myvt.page.link/vt10 de doi diem thanh luu luong data, phut goi, SMS hoac cac uu dai gia tri khac. LH 198 (0d).",0.0,1,0,brandname
[TB] KHUYẾN MẠI 50% GIÁ TRỊ LẦN NẠP TIỀN ĐẦU TIÊN VÀO CHỦ NHẬT ngày 01/05/2022. CT áp dụng khi nạp tiền trên ứng dụng MY VIETTEL có liên kết với tài khoản ngân hàng/ViettelPay/VNPAY. Tiền khuyến mại được sử dụng nội mạng trong 15 ngày. Giảm thêm 3% khi nạp ngay tại https://myvt.page.link/naptiencn. LH 198 (0đ). Trân trọng!,0.0,1,0,brandname
Do su co tam gian doan cap dien Khach hang PE13000146339 tu 09:15 - 12:15 ngay 30/04/2022. Kinh xin loi quy Khach hang va mong duoc thong cam. LH 1900545454,0.0,0,1,brandname
Do su co tam gian doan cap dien Khach hang PE13000143179 tu 09:15 - 12:15 ngay 30/04/2022. Kinh xin loi quy Khach hang va mong duoc thong cam. LH 1900545454,0.0,0,1,brandname
"[QC] TẶNG 1GB MIỄN PHÍ KHI TẠO TÀI KHOẢN TRÊN MY VIETTEL. Mời Quý khách tải ứng dụng và tạo tài khoản, đăng nhập vào My Viettel ngay tại https://myvt.page.link/welcome. Ứng dụng có nhiều tính năng hỗ trợ Khách hàng như tra cứu cước, thanh toán cước, đăng ký gói data và nhiều khuyến mại dành riêng cho Quý khách. Ưu đãi data được cộng trong 48h, sử dụng trong 7 ngày. Chi tiết LH 198 (0đ). Từ chối QC, soạn TC3 gửi 199.",0.0,1,0,brandname
"Cam on Quy KH PE13000146339 da thanh toan so tien dien thang 4/2022, so tien 404,499d. LH 1900545454",0.0,0,1,brandname
"EVNHCMC TB TIEN DIEN T4/22 KH PE13000146339 LA 404,499 VND VUI LONG T.TOAN TRUOC 22/04/2022 LH 1900545454",0.0,0,1,brandname
"EVNHCMC TB TIEN DIEN T4/22 KH PE13000143179 LA 99,976 VND VUI LONG T.TOAN TRUOC 22/04/2022 LH 1900545454",0.0,0,1,brandname
"EVNHCMC TB-Ky1T04 GHI 00:26 16/04/22 CSM1326, CSC1125 KH PE13000146339 LA201kWh TIEN 404499VND THU TIEN TU 18/04/22 LH 1900545454",0.0,0,1,brandname
"EVNHCMC TB-Ky1T04 GHI 00:44 16/04/22 CSM255, CSC200 KH PE13000143179 LA55kWh TIEN 99976VND THU TIEN TU 18/04/22 LH 1900545454",0.0,0,1,brandname
"[TB] Bộ Thông tin và Truyền thông: Hãy cài đặt sử dụng ứng dụng i-Speed để kiểm tra tốc độ truy cập Internet của bạn. Việc hưởng ứng sử dụng thường xuyên của bạn sẽ góp phần thúc đẩy phát triển, nâng cao chất lượng dịch vụ Internet Việt Nam. Cài đặt ứng dụng i-Speed tại https://speedtest.vn/tai-ve (miễn cước data khi sử dụng). ",0.0,1,0,brandname
"[TB] NHỚ NGÀY GIỖ TỔ, KHUYẾN MẠI BÙNG NỔ Soạn 4G gửi 191: MIỄN PHÍ 180 ngày dùng DATA 4G truy cập Internet, xem phim, nghe nhạc... Lưu ý: 1.Để sử dụng ưu đãi, vui lòng bật chế độ 4G/LTE trên máy (xem hướng dẫn tại http://viettel.vn/on4g ) 2.DV gia hạn sau 180 ngày với 300.000đ 3.KM áp dụng 1 lần đến 30/04/2022 cho TB nhận được tin nhắn LH 198 (0đ).",0.0,1,0,brandname
"Quy khach duoc cong them 5 diem Viettel++ boi giao dich Tieu dung vien thong thang 03/2022. Thoi han su dung diem den 30/04/2023. Hay truy cap https://myvt.page.link/vtplus tren My Viettel hoac *098# de doi diem sang Data, SMS, Phut goi cung nhieu uu dai gia tri khac. Chi tiet LH 198. Tran trong.",0.0,1,0,brandname
"[TB] Giảm ngay 3% giá trị thanh toán khi nạp thẻ vào tài khoản viễn thông cho thuê bao trả trước qua tài khoản ngân hàng hoặc tài khoản ViettelPay liên kết trên My Viettel. ĐẶC BIỆT, TẶNG THÊM 50% GIÁ TRỊ CHO LẦN NẠP THẺ ĐẦU TIÊN vào Chủ nhật ngày 03/04/2022. Tiền khuyến mại sử dụng nội mạng trong 15 ngày. Nạp tiền tại https://myvt.page.link/naptiencn . LH 198 (0đ). Trân trọng!",0.0,1,0,brandname
THPT N C Tru 12A7 N H Duy :  Tre(1/4); Sai phu hieu(1/4),0.0,0,0,brandname
"[TB] Giảm ngay 3% giá trị thanh toán khi nạp thẻ vào tài khoản viễn thông cho thuê bao trả trước qua tài khoản ngân hàng hoặc tài khoản ViettelPay liên kết trên My Viettel. ĐẶC BIỆT, TẶNG THÊM 50% GIÁ TRỊ CHO LẦN NẠP THẺ ĐẦU TIÊN vào Chủ nhật ngày 20/03/2022. Tiền khuyến mại sử dụng nội mạng trong 15 ngày. Nạp tiền tại https://myvt.page.link/naptiencn . LH 198 (0đ). Trân trọng!",0.0,1,0,brandname
"[TB] NGÀY QUỐC TẾ HẠNH PHÚC - KHUYẾN MẠI SẺ CHIA Mừng ngày Quốc tế Hạnh phúc 20/3, soạn 4G gửi 191: MIỄN PHÍ 180 ngày dùng DATA 4G truy cập Internet, xem phim, nghe nhạc... Lưu ý: 1.Để sử dụng ưu đãi, vui lòng bật chế độ 4G/LTE trên máy (xem hướng dẫn tại http://viettel.vn/on4g ) 2.DV gia hạn sau 180 ngày với 300.000đ 3.KM áp dụng 1 lần đến 31/03/2022 cho TB nhận được tin nhắn. LH 198 (0đ).",0.0,1,0,brandname
"Cam on Quy KH PE13000146339 da thanh toan so tien dien thang 3/2022, so tien 388,709d. LH 1900545454",0.0,0,1,brandname
"EVNHCMC TB TIEN DIEN T3/22 KH PE13000146339 LA 388,709 VND VUI LONG T.TOAN TRUOC 22/03/2022 LH 1900545454",0.0,0,1,brandname
"EVNHCMC TB TIEN DIEN T3/22 KH PE13000143179 LA 85,175 VND VUI LONG T.TOAN TRUOC 22/03/2022 LH 1900545454",0.0,0,1,brandname
"EVNHCMC TB-Ky1T03 GHI 00:34 16/03/22 CSM200, CSC153 KH PE13000143179 LA47kWh TIEN 85175VND THU TIEN TU 18/03/22 LH 1900545454",0.0,0,1,brandname
"EVNHCMC TB-Ky1T03 GHI 00:18 16/03/22 CSM1125, CSC931 KH PE13000146339 LA194kWh TIEN 388709VND THU TIEN TU 18/03/22 LH 1900545454",0.0,0,1,brandname
"[TB] Theo Nghị định 49/2017/NĐ-CP, thông tin thuê bao di động cần phải chính xác. Quý khách vui lòng soạn TTTB gửi 1414 để kiểm tra, nếu thông tin thuê bao không chính xác, Quý khách truy cập https://viettel.vn/s/chtt hoặc mang CMND/Thẻ căn cước/Hộ chiếu đến các điểm giao dịch Viettel gần nhất để được hỗ trợ. Nếu Quý khách đã thực hiện, vui lòng bỏ qua tin nhắn này. LH 198 (0đ). Trân trọng!",0.0,1,0,brandname
[TB] Giảm 3% giá trị thanh toán và TẶNG NGAY 20K khi nạp thẻ từ 20K vào tài khoản viễn thông cho TB trả trước qua tài khoản ngân hàng hoặc tài khoản Viettelpay liên kết trên My Viettel vào Chủ nhật ngày 13/03/2022. Tiền KM 20K sử dụng nội mạng trong 15 ngày. Nạp tiền tại https://myvt.page.link/naptiencn . LH 198 (0đ). Trân trọng!,0.0,1,0,brandname
"Quy khach duoc cong them 3 diem Viettel++ boi giao dich Tieu dung vien thong thang 02/2022. Thoi han su dung diem den 31/03/2023. Hay truy cap https://myvt.page.link/vtplus tren My Viettel hoac *098# de doi diem sang Data, SMS, Phut goi cung nhieu uu dai gia tri khac. Chi tiet LH 198. Tran trong.",0.0,1,0,brandname
"THPT N C Tru 12A7 N H Duy :  Mang giay, dep sai QD(2/3)",0.0,0,0,brandname
Thuy ah .Nêu đên mai danh em phu chi cung đc .Lam đc cang sơm cang tôt em ah,0.0,0,0,personal_number
"Cam on Quy KH PE13000146339 da thanh toan so tien dien thang 2/2022, so tien 478,449d. LH 1900545454",0.0,0,1,brandname
Nga co đô bô ưa quân cac loai thuy bao chi linh xuông ma lưa nha .Cam ơn,0.0,0,0,personal_number
"EVNHCMC TB TIEN DIEN T2/22 KH PE13000146339 LA 478,449 VND VUI LONG T.TOAN TRUOC 22/02/2022 LH 1900545454",0.0,0,1,brandname
"EVNHCMC TB TIEN DIEN T2/22 KH PE13000143179 LA 68,865 VND VUI LONG T.TOAN TRUOC 22/02/2022 LH 1900545454",0.0,0,1,brandname
"EVNHCMC TB-Ky1T02 GHI 00:18 16/02/22 CSM931, CSC703 KH PE13000146339 LA228kWh TIEN 478449VND THU TIEN TU 18/02/22 LH 1900545454",0.0,0,1,brandname
"EVNHCMC TB-Ky1T02 GHI 00:33 16/02/22 CSM153, CSC115 KH PE13000143179 LA38kWh TIEN 68865VND THU TIEN TU 18/02/22 LH 1900545454",0.0,0,1,brandname
"[TB] QUÀ TẾT TƯNG BỪNG - ĐÓN MỪNG NĂM MỚI MIỄN PHÍ 90 ngày dùng DATA 4G TỐC ĐỘ CAO, KHÔNG GIỚI HẠN LƯU LƯỢNG. Để sử dụng ưu đãi, Quý khách cần SIM 4G và máy 4G có bật chế độ 4G/LTE (xem hướng dẫn tại http://viettel.vn/on4g ). Tham gia, soạn 4G gửi 191 (0đ). DV gia hạn sau 90 ngày với 150.000đ. KM áp dụng 1 lần đến 28/02/2022 cho TB nhận được tin nhắn. LH 198 (0đ).",0.0,1,0,brandname
"Quy khach duoc cong them 12 diem Viettel++ boi giao dich Tieu dung vien thong thang 01/2022. Thoi han su dung diem den 28/02/2023. Hay truy cap https://myvt.page.link/vtplus tren My Viettel hoac *098# de doi diem sang Data, SMS, Phut goi cung nhieu uu dai gia tri khac. Chi tiet LH 198. Tran trong.",0.0,1,0,brandname
"[TB] VALENTINE - YÊU ĐI NGẠI CHI!  Viettel tặng bạn mã YEU - giảm ngay 15.800đ khi mua ST30K: Chỉ còn 14.200đ/7 ngày có 7GB data tốc độ cao, gói cước gia hạn sau 7 ngày với 30.000đ. Soạn ST30K YEU gửi 191 để đăng ký hoặc truy cập https://myvt.page.link/vlt để nhận nhiều quà tặng khác. CT áp dụng với lần đăng ký đầu tiên từ thời điểm TB nhận được tin nhắn đến hết 14/02. LH 198 (0đ).",0.0,1,0,brandname
"[TB] LÊN MẠNG THẢ GA, KẾT NỐI THẬT ĐÃ! Thỏa sức nhắn tin qua Zalo, Viber, lướt web và gọi điện với gói V50C: 50K/30 ngày có 3GB, MIỄN PHÍ gọi nội mạng (10p/cuộc, tối đa 1.000p) Đăng ký, soạn V50C gửi 191. DV gia hạn sau 30 ngày. Chi tiết truy cập https://myvt.page.link/V50C CT dành riêng cho Quý khách. LH 198 (0đ).",0.0,1,0,brandname
Cuoc goi tu so 84932699299 co phai quang cao/lam phien quy khach khong? Vui long soan: Co hoac Khong gui 9198 (MIEN PHI).,0.0,0,1,shortcode
Mây hôm cui năm chi bân qua nên chưa co qua gi cho be đâu năm mung 6 chi khai trương ban lai e cho con xuông chơi chi ly sy cho be nha hi,0.0,0,0,personal_number
Đâu xuân năm mơi chi chuc e va toan thê gđ manh khoe vui ve va hp nha .Trong moi công viêc lam ăn thuân lơi nha ,0.0,0,0,personal_number
"[TB] KHUYẾN MẠI RỘN RÀNG, HÒA NHỊP XUÂN SANG! Soạn TET gửi 191 hoặc truy cập https://098.viettel.vn để nhận các ưu đãi cực sốc: Lên mạng, gọi điện, kết nối cả năm với giá cực rẻ. Chi tiết LH 198 (0đ).",0.0,1,0,brandname
[TB] Viettel kính chúc Quý khách năm mới Nhâm Dần 2022 ngập tràn may mắn và hạnh phúc đong đầy. Trân trọng cảm ơn Quý khách đã tin tưởng sử dụng dịch vụ của Viettel!,0.0,0,0,brandname
12A7 (AD 7/2)  T2 S1: CC+SH+T+T+L;C2: Tin+Tin+QP T3 S1: AV+AV+Si+D+H;C2: AV+AV+Ly+Ly T4 S1: V+V+S+GDCD+T;C2: Van B2+Sinh+Toan B2+Toan B2 T5 S1: T+T+H+S+D T6 S1: L+L+H+V+CN;C2: Hoa+Hoa+TD+TD,0.0,0,0,brandname
"Nhan dip Tet Nham Dan,BLD va Ban Dai dien CMHS truong THPT Nguyen Cong Tru kinh chuc Quy PHHS va toan the gia dinh suc khoe,hanh phuc,binh an,van su nhu y",0.0,0,0,brandname
Do su co tam gian doan cap dien Khach hang PE13000143179 tu 14:02 - 16:02 ngay 31/01/2022. Kinh xin loi quy Khach hang va mong duoc thong cam. LH 1900545454,0.0,0,1,brandname
Do su co tam gian doan cap dien Khach hang PE13000146339 tu 14:02 - 16:02 ngay 31/01/2022. Kinh xin loi quy Khach hang va mong duoc thong cam. LH 1900545454,0.0,0,1,brandname
"Chuong trinh Li xi diem nam 2022 se bat dau dien ra tu ngay 31/01/2022, Quy khach vui long thu lai sau. Tran trong.",0.0,0,0,brandname
